,Title,Year,Genre,Director,Cast,Movie_id,cast_no,poster_url
240,kabaddi,2014,"comedy, drama, romance",ram babu gurung                 ,"dayahang rai, nischal basnet, rishma gurung, buddhi tamang",/title/tt3696800/,4,https://encrypted-tbn0.gstatic.com/images?q=tbn:ANd9GcQyQ3P44vKOgXDqUULs8CQXLHBLhEIDo1hd1vcJn3Jp-mBlpnH1CY_U0YxFuw&s
241,highway to dhampus,2014,"drama, romance",rick mcfarland                 ,"rachel hurd-wood, gunner wright, suesha rana, raj ballav koirala",/title/tt2296799/,4,https://encrypted-tbn0.gstatic.com/images?q=tbn:ANd9GcThCPDJuECjrL7gddeDKWDBSf5xXjYwUsNGnf0hkWTM1VMshjVpV8o05B6T-Tc&s
242,nai nabhannu la 2,2014,romance,bikash raj acharya                 ,"sugyani bhattarai, narendra singh dhami, priyanka karki, sitaram kattel",/title/tt8677256/,4,https://encrypted-tbn0.gstatic.com/images?q=tbn:ANd9GcR62DHz1sFmZZWg5dfqySQJwnnaMS0ZCm2c_c9DUJMcESDjvosz5VUXBEdVN_I&s
243,november rain,2014,romance,dinesh raut                 ,"aaryan sigdel, namrata shrestha, chhulthim dolma gurung, amitesh shah",/title/tt5659988/,4,https://encrypted-tbn0.gstatic.com/images?q=tbn:ANd9GcTVVEVSmlWak6yWyvup3YrrnmFYX8IgRFFz6fsaf9QeKBDCRGMtzEGVMedMkw&s
244,kohinoor,2014,drama,akash adhikari                 ,"shree krishna shrestha, shweta khadka, mithila sharma, narendra singh dhami",/title/tt8324172/,4,https://encrypted-tbn0.gstatic.com/images?q=tbn:ANd9GcRvx3ME-Aq9bvqzjeHUbR6giMg-FqKbwozWC74p-udnzQYF1uh0pQeMOLfPgg&s
245,suntali,2014,"comedy, drama",bhaskar dhungana                 ,"pramod agrahari, bipana basnet, saraswoti chaudhari, pratibha chettri",/title/tt3908994/,4,https://encrypted-tbn0.gstatic.com/images?q=tbn:ANd9GcS7hlifQhp-0YGfhe4ZMh0kvFyNiyN6p2iSkaxXl-b7KsDgVLP6VqnoQGq79_c&s
246,talakjung vs tulke,2014,"action, drama",nischal basnet                 ,"khagendra lamichhane, dayahang rai, shushank mainali, reecha sharma",/title/tt3342558/,4,https://encrypted-tbn0.gstatic.com/images?q=tbn:ANd9GcTxRLRX76iyXaDiXDQPnGTIRzUjotrhcFRaovV1Yq0v03IuIRNT_LZsB-bB_Q&s
247,love you baba,2014,drama,saugat bista                 ,"anmol agrawal, basanta bhatta, rashmi bhatta, gajit bista",/title/tt5954644/,4,https://encrypted-tbn0.gstatic.com/images?q=tbn:ANd9GcSVIJqIKgd_yEHMCT-Nu-fl-yZ-CU_kwUWzG5hggOLcSL2Wfh3_Viys2mzZ_Sc&s
248,jerryy,2014,romance,hem raj bc                 ,"anmol k.c., amalya sharma, anna sharma, abhishek man sherchan",/title/tt4620528/,4,https://encrypted-tbn0.gstatic.com/images?q=tbn:ANd9GcTImNP_vjOb8nbZStJ4rk1l7uhKifbs__R9tqbp-_6Do-O_EBcD1_ZkejdW6Ws&s
249,jholay,2014,"comedy, drama",dipendra k. khanal                 ,"dayahang rai, priyanka karki, shishir rana, prashant dawa",/title/tt7228558/,4,https://encrypted-tbn0.gstatic.com/images?q=tbn:ANd9GcTzy8dYNUbs0zG83VmUV3LcBdHGTJG1p2yB9esR5GhtGOrD6pN1LNB3tlTdtEo&s
251,raghav,2014,drama,bhupendra bhattarai                 ,"gita adhikari, basanta bhatta, cait brasel, rocken byanjankar",/title/tt3187718/,4,https://encrypted-tbn0.gstatic.com/images?q=tbn:ANd9GcRborp0cCsD4FjupcZalFvGxPlRHut71J94dYJ40DqXMrLEbg_qZBKBBjHgwA&s
252,ritu nepali feature film,2014,"drama, romance",manoj adhikari                 ,"raj ballav koirala, malina joshi, reema bishwokarma, bishnu neupane",/title/tt3451716/,4,https://encrypted-tbn0.gstatic.com/images?q=tbn:ANd9GcRkiJaSgc-p3A_W4blIL0S_Rn-3GFWncX4pu7rBh6HsZpVk5nNaSSPye3I4IqY&s
253,chha ekan chha,2014,"comedy, drama",dinesh d.c.                 ,"sandip chhetri, narendra singh dhami, neeta dhungana, kedar ghimire",/title/tt6044190/,4,https://encrypted-tbn0.gstatic.com/images?q=tbn:ANd9GcQPEpbMweuc6GtmXjhxcRN81S_8CJFH5s3fQOyfI914m9BfzsRZtisfGVediA&s
254,hasiya,2014,action,milan chams                 ,"rajesh hamal, ruby rana, shishir s.j.b. rana, anoop bikram shahi",/title/tt8754286/,4,https://encrypted-tbn0.gstatic.com/images?q=tbn:ANd9GcSnvRjnholcnuZ5UphcgJ2Bah2KNFpsLdioTvVehoPx9yc6SvT6qFEyyTjYxw&s
255,shree 5 ambare,2014,"crime, drama","s:dipa basnet, haridev oli                 ","saugat malla, keki adhikari, yama buddha, priyanka karki",/title/tt8024952/,4,https://encrypted-tbn0.gstatic.com/images?q=tbn:ANd9GcSwP6Zsjl0kTWv09pILKJ12noDnee6O5x8aWJPVxyl1ZdaugUas26cNA03MSw&s
256,fitkiree,2014,crime,"s:anup baral, haridev oli                 ","saugat malla, deeya maskey, shanti giri, anup baral",/title/tt5973366/,4,https://encrypted-tbn0.gstatic.com/images?q=tbn:ANd9GcS-Rz1CGnItS2H8OezcK9sjrwqaViB7GMTSb-1Bzme9pEWrKNAAM7eyDGJnfg&s
257,megha,2014,drama,samjhana upreti rauniar                 ,"bhintuna joshi, agraj k.c., manoj k.c., meera k.c.",/title/tt8658858/,4,https://encrypted-tbn0.gstatic.com/images?q=tbn:ANd9GcSlQEnCc-2npBoDvkUCy3JGpk1DO2UDVo20IeDx8a5EAXyT-AGCw4jHsW8sDw&s
258,mokshya,2014,"comedy, drama, music",prabin shrestha                 ,"kosish chettri, benisha hamal, basanta bhatta, bikram singh",/title/tt3521084/,4,https://encrypted-tbn0.gstatic.com/images?q=tbn:ANd9GcRrVLwj9XJKyqPxqwFrHXfXQz5Uw-DHnEg-s5o2sZpbHsa2xonNjRr-_w50EAQ&s
259,red monsoon,2014,"drama, family",eelum dixit                 ,"sandip chhetri, sudam ck, himali dixit, shristi ghimire",/title/tt2923296/,4,https://encrypted-tbn0.gstatic.com/images?q=tbn:ANd9GcTbGEZzKaWUWOUPVO09p8isf6Ca1Ib_TtaBMmSIuonJwWjL4NdBTBWtWCwqdQ&s
261,birkhelai chinchhas,2014,drama,araaj keshav giri                 ,"binita khadka, aayusha rai, subash thapa",/title/tt8477144/,3,https://encrypted-tbn0.gstatic.com/images?q=tbn:ANd9GcS0eg30GxZcIAj1HoZt892VEIb2Srw3icGB_dkj8aDrKVpVuikt4Gs6FgAI7BU&s
262,save the country,2014,history,lawa pyakurel                 ,"sujana dhakal, mayoun jirel, ghimire kc, sapana rokka",/title/tt15393054/,4,https://encrypted-tbn0.gstatic.com/images?q=tbn:ANd9GcRLXyy8OlksmwOPSJ4dGdwLgAw73fPyFqmneh3YDVhJT4_pa66akZ--v9ndrQ&s
263,mukhauta,2014,crime,arpan thapa                 ,"rajesh hamal, sunil thapa, saugat malla, arpan thapa",/title/tt13369528/,4,https://encrypted-tbn0.gstatic.com/images?q=tbn:ANd9GcS215qkr7cDO_GDt-XQ-xyFHHDbGF19ZPk4vwAehX8nkbTDmUIRfl4PL2-YRe8&s
264,tandav,2014,action,murray kerr                 ,"bisharad basnet, kameshwor chaurasiya, alan gurung, bipin karki",/title/tt7165932/,4,https://encrypted-tbn0.gstatic.com/images?q=tbn:ANd9GcRAJUMtO__WCIYmnIECtQRjvNA9Xx26YgiQjSbCZFUg_pY30_z1HHX3wNN1rKg&s
265,the palmist,2014,"drama, mystery, romance",hitesh sharma                 ,"sameer bhattarai, hitesh sharma, sunny amatya, prakash subedi",/title/tt4701840/,4,https://encrypted-tbn0.gstatic.com/images?q=tbn:ANd9GcT1_KmHvRYBLGzor0c-29T3htR_V6Xao8gZ4UKzM6kaVC_oeC22ZuLTvaRki5k&s
266,akaal,2014,drama,neer bikram shah                 ,"deepak chhetri, rajesh hamal, neer bikram shah, rekha thapa",/title/tt8915854/,4,https://encrypted-tbn0.gstatic.com/images?q=tbn:ANd9GcTDw1Hc_4yCYBzLrWD_j2qkN0s_PcpffcFDWTAgNb9TvKLQVYqyH7E-28mB1J4&s
267,producer,2014,comedy,janak deep parajuli                 ,"ram prasad aryal, shyam aryal, shweta bhattarai, babu bogati",/title/tt4852030/,4,https://encrypted-tbn0.gstatic.com/images?q=tbn:ANd9GcQTjFnFvUJuLBJwGiM41zhROCH0tHVEs1PMwq4NlgmjJFWqjrUu24NfWCs8JW8&s
268,dhartiputra,2014,action,amar oli                 ,"bikrant basnet, dilip rayamajhi, sunil thapa",/title/tt22044694/,3,https://encrypted-tbn0.gstatic.com/images?q=tbn:ANd9GcQjAAW0HZWJtV-_dsUJKNsvlJJJe5CzuKw30zAvuYaP7E1PnE5TLEMl9vVHZA&s
269,punte parade,2014,"drama, romance",subash koirala                 ,"samyam puri, nilu doma sherpa, priyanka karki, najir hussain",/title/tt7243914/,4,https://encrypted-tbn0.gstatic.com/images?q=tbn:ANd9GcQJxfJ5eGnInoiHkGs9EpCmMCaY-9RRuu5fAZz-JFQi7VoMog_tzXv5sDOTLuU&s
270,utsav,2014,drama,kumar bhattarai                 ,"saugat malla, sanjog koirala, gaurav pahari, menuka pradhan",/title/tt6634928/,4,https://encrypted-tbn0.gstatic.com/images?q=tbn:ANd9GcR-t9PKHoaDSKByXgaILv3uRw6zUbG4Bcxvfis3AYVI-2z-thQrNewirnORQw&s
271,biteka pal,2014,romance,suraj subba                 ,"keki adhikari, baboo bogati, bimala thatal",/title/tt8661390/,3,https://encrypted-tbn0.gstatic.com/images?q=tbn:ANd9GcQX4TrO0GZf9axRCet4YTDIjM6q72d1kcrb-Scy8Oqtf9MP3HK-BGkyxLwykWo&s
272,himmatwali,2014,drama,rekha thapa                 ,"teja ayyar, puskar bhatta, abhay chand, dhiraj chand",/title/tt7243896/,4,https://encrypted-tbn0.gstatic.com/images?q=tbn:ANd9GcRg5kkP62FdD8GNb7R1ZspTmOs9zKi8Tq7RfK5QXqTLeJluI3wUXGLAD5Y5ZNw&s
273,baby,2015,"action, crime, thriller",neeraj pandey                 ,"akshay kumar, danny denzongpa, rana daggubati, taapsee pannu",/title/tt3848892/,4,https://encrypted-tbn0.gstatic.com/images?q=tbn:ANd9GcRnGF28lDZLtRAAeAQxMw7qTm82DV6ADNTh9_QvcwnJp2l0fPT0XS8hl0PIdhc&s
274,hostel returns,2015,drama,suraj bhushal                 ,"sushil shrestha, najir hussain, abhay baral, sushil sitaula",/title/tt6501286/,4,https://encrypted-tbn0.gstatic.com/images?q=tbn:ANd9GcTf_W5V2oIHnZ3CqylwwvJ8CUo69VrotwWQx3R__NAaFkqB4JIQ7pBBE0fTm0k&s
275,kalo pothi,2015,"action, drama, history",min bahadur bham                 ,"khadka raj nepali, sukra raj rokaya, jit bahadur malla, hansha khadka",/title/tt4991660/,4,https://encrypted-tbn0.gstatic.com/images?q=tbn:ANd9GcQ1WWRX_PDRAjwxJQ-zC_vthck5ws9J_8JBCJGDNq_JydBBuPYxli65JbGfOQ&s
276,kabaddi kabaddi,2015,"comedy, drama",ram babu gurung                 ,"dayahang rai, saugat malla, rishma gurung, bijay baral",/title/tt5225580/,4,https://encrypted-tbn0.gstatic.com/images?q=tbn:ANd9GcTg1r_G6ZBULWYHiJmAkJsvRbDTFncIwFmp2X29pzsxobHwaDTkQNTQV_L5SGQ&s
277,taandro,2015,"action, drama",samten bhutia                 ,"dayahang rai, kamal mani nepal, rajan khatiwada, buddhi tamang",/title/tt5252250/,4,https://encrypted-tbn0.gstatic.com/images?q=tbn:ANd9GcTGUFm2I6Q0wMqlp-HqRDf1Po9INEOnw7gKst0IQuMGooZFhTYB1hoGD0ShtPM&s
278,the necklace,2015,"crime, drama, mystery","s:david chow, rudra bahadur gurung                 ","dipti gurung, roshni karki, r.c. manoj, nirvik rai",/title/tt5126250/,4,https://encrypted-tbn0.gstatic.com/images?q=tbn:ANd9GcSqGDl2n9-MzwmZ-FBif6hDG0m7kF8u2KJ2unhbkpPhySs7dvtsfGzhlGDZuD8&s
279,zhigrana,2015,"horror, mystery, thriller",pasang lama                 ,"sagar adhikari, subash basnet, hari prasad bhattarai, patricia buigenet",/title/tt4448446/,4,https://encrypted-tbn0.gstatic.com/images?q=tbn:ANd9GcTxTdFoLVWw5OBl5JoCT8piEemKwDy6_Tzi_qgudhfB1WcD1Jy5hfEpYJYKHA&s
280,bhool bhulaiyaa,2015,romance,yogesh ghimire                 ,"neeta dhungana, jiwan luitel",/title/tt9081378/,2,https://encrypted-tbn0.gstatic.com/images?q=tbn:ANd9GcSNtSfgojEIamqmIX11TNTeEgDxPluBvP14jAqUxiY3LuaXUB3BiSOiTizldCA&s
281,sadanga,2015,action,suraj sunuwar                 ,"saugat malla, sauram raj tuladhar, priyanka karki, anup baral",/title/tt11671066/,4,https://encrypted-tbn0.gstatic.com/images?q=tbn:ANd9GcSYOBkJqJYYcLB0pqA17LaCT9XRKzWg8nKr7fHcYdywaZEdX60xT8BnWvNfaZI&s
282,pardeshi,2015,"drama, family",narayan rayamajhi                 ,"raju bajaj, keshab bhattarai, sher bahadur gurung, rajani k.c.",/title/tt7091544/,4,https://encrypted-tbn0.gstatic.com/images?q=tbn:ANd9GcRsaXvsCnQ4L2RKGi7X21F6H37Eo_5Gl-Qj-147aLDtm45e3WmM-4bpRK1U_w&s
283,ko afno,2015,"drama, thriller",anil thapa                 ,"sulakshyan bharati, sudam ck, shanti giri, rajan khatiwada",/title/tt5302258/,4,https://encrypted-tbn0.gstatic.com/images?q=tbn:ANd9GcTv6jr5GEJLkUFFhxe8L3twubJMoi9JEJ1MEPuF9Y5SR5iMxB4D61Mvi-6l-bI&s
284,bhairav,2015,drama,nikhil upreti                 ,"jay kishan basnet, narendra singh dhami, muralidhar, nagendra rijal",/title/tt7229056/,4,https://encrypted-tbn0.gstatic.com/images?q=tbn:ANd9GcSK_p-hvLc5MJOVUXkFW8K30UVmiYBL5waa4Ok8esxXyohdEoeszetMJA9lkQ&s
285,mission paisa 2: reloaded,2015,action,simosh sunuwar                 ,"nisha adhikari, amir gautam, priyanka karki, resh marhatta",/title/tt7201056/,4,https://encrypted-tbn0.gstatic.com/images?q=tbn:ANd9GcTXeSijbzsXBRCNy4PKYa09XNQjKx9gzIhJ-q5dLSYQuy4hC_cZuQWsB-hinh0&s
286,resham filili,2015,"comedy, drama",pranab joshi                 ,"shishir bangdel, kameshwor chaurasiya, narendra singh dhami, laxmi giri",/title/tt4624138/,4,https://encrypted-tbn0.gstatic.com/images?q=tbn:ANd9GcTV8CbFxAt2N0pFp58ZSiyUF85o51I9dG0NBZqJM5JPg_rEgERPbky7qmh_eew&s
287,woda number 6,2015,comedy,ujwal ghimire                 ,"sandip chhetri, kedar ghimire, deepak raj giri, aruna karki",/title/tt6569172/,4,https://encrypted-tbn0.gstatic.com/images?q=tbn:ANd9GcRuNheQzBF4a3uR5nohCpkV-FkQHVgdZPdaWASRn2bgXpzjr81YChrv4NQwH7o&s
288,dristibhram,2015,"drama, mystery, romance",kiran thapa                 ,"kiran thapa, bijay kunwar, cilsa jirel, nitesh jung thapa",/title/tt4361472/,4,https://encrypted-tbn0.gstatic.com/images?q=tbn:ANd9GcQ2XkAF5I21J1SrUIJeT5xJ3MNLJdd3S9MdHNbc7O_Y4dPpRhPCI1lzmIDfIQg&s
289,seto bagh,2015,"drama, history",neer bikram shah                 ,"manish bhandari, binay dahal, anita dangal, narendra singh dhami",/title/tt6044656/,4,https://encrypted-tbn0.gstatic.com/images?q=tbn:ANd9GcR3NzBbxh1EilE11QgMMEVGxP3kNh7fVK7xFMYCWgmzm3CfdhtVnnMDi1z-UR8&s
290,nai nabhannu la 3,2015,romance,"s:muskan dhakal, lakpa chhiring tamang                 ","aaryan sigdel, priyanka karki, suraj singh thakuri, sanchita luitel",/title/tt8677388/,4,https://encrypted-tbn0.gstatic.com/images?q=tbn:ANd9GcQxVIm0D0lqtxB3xIHiV10SLDdEtoNTyIUx7LAEFQe5Gxf4cV4ZioIUMxYICRs&s
291,dhruva tara,2015,drama,nikky ngawang golay                 ,"kushal ghimiray, manisha gurung, topchen moktan, avinash wanem subba",/title/tt5906842/,4,https://encrypted-tbn0.gstatic.com/images?q=tbn:ANd9GcRccLCw1RfROv2ljDeoA6-jgNVNMuMDdfWrMXdpvkjooL2ChHlOSgfJJ2tQSg&s
292,sunpani,2015,drama,sabin bastola                 ,"sabin bastola, agraj k.c., tara k.c., nabin timalsina",/title/tt8878514/,4,https://encrypted-tbn0.gstatic.com/images?q=tbn:ANd9GcStBqrO5SEVJ83h3SUuds6EixCWHpG4ja3yTpL-o1p109QHWXs8eK5WyDvFMA&s
294,aavash,2015,"drama, romance",surendra poudel                 ,"samyam puri, ashma d.c., nisha adhikari, salon basnet",/title/tt6450916/,4,https://encrypted-tbn0.gstatic.com/images?q=tbn:ANd9GcSUhC-nXmDX1zmPm1i-hmYoVfiWeDHIyBxIohqY_ZThOWfDGCHtAGB7iL_-coc&s
295,dhauli,2015,family,"s:santosh kumar atreya, ghanshyam lamichhane, santosh kumar atray                 ","geeta adhikari, gajit bista, prakash ghimire",/title/tt11822438/,3,https://encrypted-tbn0.gstatic.com/images?q=tbn:ANd9GcSMHJCw6lBf37-qvWuFS89W9ujhtjE-iJ5Z0W6pto9te7DANvdAcHiEcS3lj54&s
296,desh dekhi bidesh,2015,action,narendra thapa                 ,"dilip rayamajhi, richa sharma, nikhil upreti",/title/tt22008154/,3,https://encrypted-tbn0.gstatic.com/images?q=tbn:ANd9GcTRx1Z2l7nkTeMpIP-3_j16I1cNYZFoPGw_qIc2BQlaEDBza-z1ZUBWTgE7TA&s
297,ajhai pani,2015,drama,alok nembang                 ,"narendra singh dhami, bishal dhungana, puspa khadka, bijay lama",/title/tt5972072/,4,https://encrypted-tbn0.gstatic.com/images?q=tbn:ANd9GcTR6KOceuIJHzNBfAhcIK1ScnSpiFIqOlcTzKbbn8vnWT_yyyEG-PaECOvi_Q&s
298,chankhe shankhe pankhe,2015,comedy,sudarshan thapa                 ,"subash thapa, sudarshan thapa, prem puri, pooja sharma",/title/tt5955818/,4,https://encrypted-tbn0.gstatic.com/images?q=tbn:ANd9GcRxjYzG1micACX4cp-rxp_B-388_gnKFon41r1i41TStElgaK9eLzkoBUQ6-RE&s
299,youngster: nepali film,2015,drama,subba bishal                 ,"pradhan ajtej, lepcha alvin, dewan suhmita",/title/tt10847722/,3,https://encrypted-tbn0.gstatic.com/images?q=tbn:ANd9GcRkk0vcmB4QPx3nG3KJtXPAZ4Vhd6cKRVS1JoFgvezRvlKcoanWL6wBZp8Jpg&s
300,tata bye bye,2015,drama,ishir bangde,shishir bangdel,/title/tt5139922/,1,https://encrypted-tbn0.gstatic.com/images?q=tbn:ANd9GcSej2EPZxvGUJOLWXSoLG4foTmPgPIDmgtmLuNNJBJEYGk_gCVuOX0-zFFMc4g&s
301,tista pariko saino,2015,romance,khil bahadur gurung                 ,"amir gurung, khil bahadur gurung, raj gurung, unita gurung",/title/tt20426148/,4,https://encrypted-tbn0.gstatic.com/images?q=tbn:ANd9GcSaRMfzg2EGlnlcPqqQ7yjNVvqQETi3MA91Evk97aohV3ooLcEq2518zGJdtRc&s
303,zindagi rocks,2015,"romance, comedy",nikesh khadka                 ,"sauram raj tuladhar, prakriti shrestha, reecha sharma, keki adhikari",/title/tt11650960/,4,https://encrypted-tbn0.gstatic.com/images?q=tbn:ANd9GcS3jh-XJyxjapzW4NMdm06jYfURciVWeXn4nxsemlsp3-83N96pTXPrlkgqSw&s
304,in search of a nation,2015,"drama, family",prakash angdembe                 ,"hemanta budhathoki, baboo bogati, meena koirala, aruna karki",/title/tt2808236/,4,https://encrypted-tbn0.gstatic.com/images?q=tbn:ANd9GcQF4zSXThxFqLVKlg1BPegZsPESOOk_JUje50xzq1E9SEDV0NK_T1zYPd8NrQ&s
305,sambodhan,2015,crime,hem raj bc                 ,"dayahang rai, prasant tamrakar, binay bhatt, namrata shrestha",/title/tt6624908/,4,https://encrypted-tbn0.gstatic.com/images?q=tbn:ANd9GcTApCovkcjY-f8H6RrihTU8M37R5eEUBG9JFIWhY_fT22A5jOo41F1NeB_fTHc&s
306,aago 2,2015,drama,madan ghimire                 ,"sushil chhetri, priya rizal, hemanta budhathoki, ganesh giri",/title/tt6774938/,4,https://encrypted-tbn0.gstatic.com/images?q=tbn:ANd9GcRa8Mu1srglGeGcGwJCkHGtneGOHFnJLIEdUTJbTbIf9nZsbwnKlxzMOTv_2Q&s
307,the jungle book,2016,"animation, adventure, drama",jon favreau                 ,"neel sethi, bill murray, ben kingsley, idris elba",/title/tt3040964/,4,https://encrypted-tbn0.gstatic.com/images?q=tbn:ANd9GcTdkII7ToPTCGVOrMfI_u6BZiRVsoK2xsrl8b4KL5xQsQxivYZQ4n9ykgF2gA&s
308,pashupati prasad,2016,"comedy, drama, romance",dipendra k. khanal                 ,"khagendra lamichhane, rabindra singh baniya, bipin karki, prakash ghimire",/title/tt5691226/,4,https://encrypted-tbn0.gstatic.com/images?q=tbn:ANd9GcQv-lXz4tPNVU4keTRxcs0mR7ZzBJ5js2LwAjEPYSMMOQGeTsbC18Zf5ZqVHOE&s
309,white sun,2016,"adventure, drama",deepak rauniyar                 ,"dayahang rai, asha magrati, rabindra singh baniya, sumi malla",/title/tt3638644/,4,https://encrypted-tbn0.gstatic.com/images?q=tbn:ANd9GcSEDOGsuPz0bDi2Y9pMUsX0EHydbjh2cIcTDBNdlWFW0qyp7BPQUYWiB774CiA&s
310,superhit,2016,thriller,niranjan pandey                 ,"binita baral, sudam ck, divya dev, shishir rana",/title/tt10240904/,4,https://encrypted-tbn0.gstatic.com/images?q=tbn:ANd9GcS1nbMh4pT0JmWWZ8g_Qf1FgFoXUSsPyyoxu64ervnSOldvivRhGu_QPNXiFro&s
311,the legend of shankhadhar,2016,"animation, biography, drama",sanyukta shrestha                 ,"kiran k.c., rajaram poudel, madan krishna shrestha",/title/tt6999010/,3,https://encrypted-tbn0.gstatic.com/images?q=tbn:ANd9GcRq5vuW0nBsT8PDu-7gOumsrS8wgtMJK7PnwJSxb_HfqPhA2VcoAxzCwpIV3U8&s
312,prem geet,2016,romance,sudarshan thapa                 ,"pradeep khadka, pooja sharma, saroj khanal, rupa rana",/title/tt6705126/,4,https://encrypted-tbn0.gstatic.com/images?q=tbn:ANd9GcTU50bjCoPcd-1UArbRTXALUPR0MU3wmuRFjxPMxNhkyScjBf2ZGteSWD9Vuw&s
313,purano dunga,2016,"comedy, drama",ram babu gurung                 ,"dayahang rai, maotse gurung, menuka pradhan, priyanka karki",/title/tt6782422/,4,https://encrypted-tbn0.gstatic.com/images?q=tbn:ANd9GcT5U0OQ3ctntGv67lFu_v8XIsLwLYppKxX5wUe3znwPaFA1YEVhhfvmSTNO3w&s
314,chhakka panja,2016,"comedy, drama, family",deepa shree niraula                 ,"deepak raj giri, kedar ghimire, buddhi tamang, jeetu nepal",/title/tt6160932/,4,https://encrypted-tbn0.gstatic.com/images?q=tbn:ANd9GcTP95goQOshoPNhSSrT6Pu9LraDd6MlgZlc9NkdCawdiSHjLEvJE0aXZFGqhQ&s
315,dreams,2016,romance,bhuwan k.c.                 ,"manoj giri, anmol k.c., sandhya kc, ratna raut",/title/tt5804178/,4,https://encrypted-tbn0.gstatic.com/images?q=tbn:ANd9GcQhS85WYRtuhvoMQ2-SF4ksU48X_MJzCqVolln_FY1cyyN_kITB45qtSZqzh0E&s
316,jatra,2016,"action, comedy, drama",pradeep bhattarai                 ,"bipin karki, barsha raut, rabindra jha, rabindra singh baniya",/title/tt6249904/,4,https://encrypted-tbn0.gstatic.com/images?q=tbn:ANd9GcTdHYGTs6ZeWCHMef3ktF3kkiwff2ziJMjDRjgnul-zPaNt-O8Nu1i8FiciDg&s
317,bir bikram,2016,"action, comedy, romance",milan chams                 ,"dayahang rai, anoop bikram shahi, deeya pun, arpan thapa",/title/tt6568628/,4,https://encrypted-tbn0.gstatic.com/images?q=tbn:ANd9GcRnlDNE2102d3L0aF5kXY1b_3ZNfcvO516-fynXwv3MhL32RYmKI2oZ07bjKQ&s
319,teen ghumti,2016,"biography, drama",dhakal baburam                 ,"garima panta, dhruba dutta, sushant karki",/title/tt5642582/,3,https://encrypted-tbn0.gstatic.com/images?q=tbn:ANd9GcQ7ThJ28Ptay3rfsf7gPDmflAsoK3wokbYRSgqnpjPznsJ2YngvbS6Rc4tapng&s
320,karkhana,2016,drama,amardeep sapkota                 ,"jebica karki, nabin lamsal, mausami malla, sushil shrestha",/title/tt7683198/,4,https://encrypted-tbn0.gstatic.com/images?q=tbn:ANd9GcQdVuMzPMa5hUi47FfTrr2xufxJ8Fi8GTuBJwcapAuE0FBPBdmv8UaspGYlrA&s
321,ke ma timro hoina ra,2016,romance,akash adhikari                 ,"aaryan adhikari, arun adhikari, mariska pokharel",/title/tt7643854/,3,https://encrypted-tbn0.gstatic.com/images?q=tbn:ANd9GcQGlm8yGtTtIzLX8Rp8AG5elewH7T63di6RL5utEsPM5qme4cUlH3QIJBmAAQ&s
322,the winner,2016,thriller,hikmat bista                 ,"ale corsino, amit giri, malina joshi, royal maskey",/title/tt6352664/,4,https://encrypted-tbn0.gstatic.com/images?q=tbn:ANd9GcTxECuTd-fF9ToL5rpNFD_TZ55mKlSB2gNivIMkg2zOMjgEfY1VV-66wmvikQ&s
323,kismat 2,2016,drama,rishi lamichhane                 ,"kishor khatiwada, shilpa pokhrel, prithivi raj prasai",/title/tt12318790/,3,https://encrypted-tbn0.gstatic.com/images?q=tbn:ANd9GcSs_Ip11IXEIGVcckfsDlkUEMqWpX5dKVGVhB6NMS0pysEXkHXdsoG4u2n2lQ&s
324,dying candle,2016,"drama, family",naresh kumar kc                 ,"bidhya karki, saugat malla, kesab rai, srijana subba",/title/tt3552320/,4,https://encrypted-tbn0.gstatic.com/images?q=tbn:ANd9GcT0ZjqcGIe5p4O6XH5dw7dlXrjiPVaBbq_1XJ1jA5mzO1YZLtpewKWH_P_58jE&s
326,safar,2016,"adventure, drama",ashish shrestha                 ,"manan sapkota, nurja shrestha, sanjay gupta, shibir pokharel",/title/tt6091496/,4,https://encrypted-tbn0.gstatic.com/images?q=tbn:ANd9GcTMVyibAIgbumdfJBze4pG14vchlSRQwrIcZyedzudqLd6svJVGyQD2StVO7QA&s
327,lama la,2016,drama,"s:nischal poudyal, manoj kumar pant                 ","ravi karki, jivan pulami",/title/tt6023632/,2,https://encrypted-tbn0.gstatic.com/images?q=tbn:ANd9GcQ3GEaV4Htg_Ab2tfgR_NlygOGSf6NlqTaL2_0xfIIOosG66_r9xxhnDDnCzg&s
328,nai nabhannu la 4,2016,romance,bikash raj acharya                 ,"priyanka karki, barsha raut, anubhav regmi, paul shah",/title/tt8677400/,4,https://encrypted-tbn0.gstatic.com/images?q=tbn:ANd9GcTA8WkRrFth6PdOTSk_-3vtN8jkdjFkwuLNMEOD7fuVb9c-ZAEpNElFGKpUryA&s
329,u turn,2016,drama,prem lama                 ,"prasuna kadel, prem lama, etisha nembang",/title/tt6684398/,3,https://encrypted-tbn0.gstatic.com/images?q=tbn:ANd9GcSuI6Om0Irjb-zhvvtwt1EY7wd6Lbp9ncfDVzed-EJVam3ClhFJUKgkTJ-uj2M&s
330,bijuli machine,2016,"comedy, drama, sci-fi",navin awal                 ,"abhishek subedi, jeewan adhikary, jiban bhattarai, rajesh hamal",/title/tt6577538/,4,https://encrypted-tbn0.gstatic.com/images?q=tbn:ANd9GcRLEL_ddKdiRg2Vc4BrftnCbOefg_-a-FrG3RXeSH-uprgu2nCSv4DChTJmKoE&s
331,gajalu,2016,"drama, family, romance",hem raj bc                 ,"anmol k.c., shristi shrestha, gaurav pahari, salon basnet",/title/tt6419748/,4,https://encrypted-tbn0.gstatic.com/images?q=tbn:ANd9GcQOkdPs0DwX1MQUXc4zGyPgvS3nPs9yEEjqZxI7TzNvrxGOyyyyNBbNM35jQA&s
332,homework,2016,"drama, family",nirak poudel                 ,"vijay lama, gauri malla, namrata shrestha, aaryan sigdel",/title/tt8706358/,4,https://encrypted-tbn0.gstatic.com/images?q=tbn:ANd9GcRlBop_hYadZHutxNlQzipeaJE7fL5bX0w8Fo3X9gEk3MUbScWbV1UzanQMpg&s
333,vedi gothale,2016,drama,ganesh gurung                 ,"asmi gurung, ganesh gurung, rajesh gurung, sanam gurung",/title/tt7039460/,4,https://encrypted-tbn0.gstatic.com/images?q=tbn:ANd9GcSs1XwXf6cyZvWPd3024kz7CZCy3wnrY2TsdVE7_2UdF634M3xiyTydZ15O04s&s
334,lukamari,2016,"comedy, crime",shree ram dahal                 ,"saugat malla, karma shakya, bikram singh, surabina karki",/title/tt5595416/,4,https://encrypted-tbn0.gstatic.com/images?q=tbn:ANd9GcSUDxFB5UXApJiIinziMwUrcoe6zHbpy-s4BxKpy18UAB02dEqaHLEyL8z_AA&s
335,kaha bhulna sakchu,2016,drama,"s:enos lama, sanjok roka                 ","milan gurung, prasansa khawash, sanuja roka",/title/tt6918784/,3,https://encrypted-tbn0.gstatic.com/images?q=tbn:ANd9GcSRWlfekHXwM39pb8WW8oYkoqbMTkBJlRGZLtXOnR7gIQ2qWLVTWiGdhFeXGQ&s
336,kafal pakyo,2016,"drama, romance",sabitri khatri                 ,"jiwan luitel, barsha raut, b.s. rana, barsha singh chhettri",/title/tt7382524/,4,https://encrypted-tbn0.gstatic.com/images?q=tbn:ANd9GcQceGKF5aPkOLxLOWvO4HqDb3ppsOCKjEtgrWgYcqyDk7Qce4L9UBNOPfM1s0k&s
337,bato muniko phool 2,2016,"drama, romance",subarna thapa                 ,"reema bishwokarma, babu bogati, yash kumar, ashishma nakarmi",/title/tt7836584/,4,https://encrypted-tbn0.gstatic.com/images?q=tbn:ANd9GcSgHlrExvZyVFDJjozUelDZf8_Oxw8QNDwyWaCa-_YkO_ghZ698IzOFNkurOg&s
338,sherpa dai,2016,comedy,gopal dhakal                 ,"gopal dhakal, doma hyolmo, shishir rana, chhiring sherpa",/title/tt15662016/,4,https://encrypted-tbn0.gstatic.com/images?q=tbn:ANd9GcQ-3oiDnj8O8PMB9ad21eGECXP-0UcOHs-f_pvQ0B3x_ODfo0YKPeykMw8yww&s
339,gaatho,2016,thriller,suraj bhushal                 ,"abhay baral, najir hussain, aruna karki, dhurba koirala",/title/tt15988786/,4,https://encrypted-tbn0.gstatic.com/images?q=tbn:ANd9GcQDuGwGNnES-b2KjNVu96Tskg1UDBIiXp_w7x9aKeSHd6vcRPF38fO8PVNKdx4&s
340,fanko,2016,"action, drama, thriller",subarna thapa                 ,"saugat malla, keki adhikari, dayahang rai, priyanka karki",/title/tt6149934/,4,https://encrypted-tbn0.gstatic.com/images?q=tbn:ANd9GcR5d6sS5XX2HKVwW1RFt5PnAdVNBwG8RMAMem88lxTLOJbP0PS2WpUthRC8GyI&s
341,radha,2016,"drama, romance",yogesh ghimire                 ,"jiwan luitel, sanchita luitel",/title/tt7869094/,2,https://encrypted-tbn0.gstatic.com/images?q=tbn:ANd9GcQ-AvC-7-cPSNkChLh_Nt2fbSaiKffs8O_c4JLZosieHD4MzZXTIEAQQiCnOQ&s
342,jhumkee,2016,thriller,apil bista                 ,"pramod agrahari, rabindra singh baniya, bijay baral, bisharad basnet",/title/tt6730644/,4,https://encrypted-tbn0.gstatic.com/images?q=tbn:ANd9GcShotZheVKDJcRomH-rbTiRNCRsYgkqu-fBRavZ61NZTjyevvazvN4Hn3DTIT8&s
343,rahadani,2016,drama,dabbu kshetri                 ,"binita ghimire, rupa khanal, nabin lamsal, dayahang rai",/title/tt8878780/,4,https://encrypted-tbn0.gstatic.com/images?q=tbn:ANd9GcRchPSNLIaS1V-bP-bK3a2-PKR7eJg6MNOw9fwbKqj6ykScL3gVNOfViMDSfzI&s
